{
  "$schema": "https://json-schema.org/draft/2020-12/schema",
  "$id": "urn:target-id:build-governance:machine-event:v1",
  "title": "Governed DSS machine event",
  "type": "object",
  "additionalProperties": false,
  "required": ["schema_version", "event_id", "observed_at", "project_key", "job_id", "targets", "outcome", "accepted_baseline_id", "fingerprints", "metrics", "claim_values", "assertions"],
  "properties": {
    "schema_version": {"const": 1},
    "event_id": {"type": "string", "minLength": 1},
    "observed_at": {"type": "string", "format": "date-time"},
    "project_key": {"type": "string", "minLength": 1},
    "job_id": {"type": "string", "minLength": 1},
    "targets": {"type": "array", "minItems": 1, "uniqueItems": true, "items": {"type": "string", "minLength": 1}},
    "outcome": {"enum": ["SUCCESS", "FAILED", "ABORTED"]},
    "accepted_baseline_id": {"type": "string", "minLength": 1},
    "fingerprints": {"$ref": "#/$defs/fingerprintGroups"},
    "metrics": {"type": "object", "minProperties": 1, "additionalProperties": {"type": ["string", "number", "integer", "boolean", "null"]}},
    "claim_values": {"$ref": "#/$defs/claimValues"},
    "assertions": {
      "type": "array",
      "minItems": 1,
      "items": {
        "type": "object",
        "additionalProperties": false,
        "required": ["id", "status"],
        "properties": {
          "id": {"type": "string", "minLength": 1},
          "status": {"enum": ["PASS", "FAIL", "ERROR"]}
        }
      }
    }
  },
  "$defs": {
    "fingerprintMap": {"type": "object", "minProperties": 1, "additionalProperties": {"type": "string", "pattern": "^sha256:[0-9a-f]{64}$"}},
    "fingerprintGroups": {
      "type": "object",
      "additionalProperties": false,
      "required": ["recipe_settings", "schemas", "data", "refresh_state"],
      "properties": {
        "recipe_settings": {"$ref": "#/$defs/fingerprintMap"},
        "schemas": {"$ref": "#/$defs/fingerprintMap"},
        "data": {"$ref": "#/$defs/fingerprintMap"},
        "refresh_state": {"$ref": "#/$defs/fingerprintMap"}
      }
    },
    "claimValues": {
      "type": "object",
      "minProperties": 1,
      "additionalProperties": {"type": "object", "minProperties": 1, "additionalProperties": {"type": ["string", "number", "integer", "boolean", "null"]}}
    }
  }
}
